{
  "specversion": "1.0",
  "type": "orchestrator.subscriptions.requested.v1",
  "source": "/services/home-assistant",
  "id": "d4e6c2a1-1e2b-4c3d-a5f8-7b018a4cb1d0",
  "time": "2025-04-19T16:30:00Z",
  "datacontenttype": "application/json",
  "dataschema": "https://raw.githubusercontent.com/alves-dev/SyncLife/main/events/schema/orchestrator/subscriptions.requested.v1.json",
  "data": {
    "service_id": "home-assistant",
    "queue_name": "home-assistant.consumer",
    "subscriptions": {
      "event_types": [
        "health.nutri.liquid_summary.calculated.v1",
        "health.body.sleep_detected.v1"
      ]
    }
  },
  "extensions": {
    "correlation_id": "789f12cd-abc9-4321-a7c1-111223344556",
    "causation_id": "event-startup",
    "origin": "home-assistant"
  }
}
